number,value,datetime_start,datetime_complete,duration,params_bagging_fraction,params_bagging_freq,params_boosting_type,params_feature_fraction,params_lambda_l1,params_lambda_l2,params_learning_rate,params_max_depth,params_min_data_in_leaf,params_min_gain_to_split,params_num_leaves,state
268,0.7613914300457345,2025-10-14 02:51:33.821826,2025-10-14 02:52:15.049442,0 days 00:00:41.227616,0.8811108832702748,4,gbdt,0.9479586754557402,0.27043688828569995,0.004622905541869451,0.006617735743495501,12,45,0.03577309675698972,40,COMPLETE
269,0.7612094298127536,2025-10-14 02:52:15.054139,2025-10-14 02:52:45.197320,0 days 00:00:30.143181,0.8734443841929795,4,gbdt,0.937527037498142,0.24646817293654033,0.6810441273414073,0.0073034626988348625,12,43,0.03484298031805349,40,COMPLETE
270,0.76128420823668,2025-10-14 02:52:45.202938,2025-10-14 02:53:18.708100,0 days 00:00:33.505162,0.8905739587337493,4,gbdt,0.9273240988624836,0.288645524310531,0.40651425615111136,0.0068774183282563316,12,52,0.033781355302247164,32,COMPLETE
271,0.7613261073896347,2025-10-14 02:53:18.713252,2025-10-14 02:53:59.876810,0 days 00:00:41.163558,0.917243236983397,4,gbdt,0.9540298923190622,0.22899448971426176,0.5529721858000624,0.00646012696721553,12,48,0.03559242362458632,40,COMPLETE
272,0.7615470799240833,2025-10-14 02:53:59.881013,2025-10-14 02:54:34.176124,0 days 00:00:34.295111,0.9001848311509107,4,gbdt,0.9224680762173797,0.2699399310584706,0.6456936365078608,0.007806586280309994,12,50,0.03300761816814299,40,COMPLETE
273,0.7539437500337896,2025-10-14 02:54:34.179009,2025-10-14 02:56:32.851618,0 days 00:01:58.672609,0.8835109882585142,4,dart,0.9683126948290712,0.25827793868427407,0.43970566670017525,0.007012666954831922,12,46,0.034442662323238504,32,COMPLETE
274,0.7610904213261176,2025-10-14 02:56:32.855933,2025-10-14 02:57:09.272930,0 days 00:00:36.416997,0.871262082701231,4,gbdt,0.9354125500948903,0.24439078171078715,0.5088097416366724,0.006225767028698314,12,49,0.03669015529915328,40,COMPLETE
275,0.7613451131755586,2025-10-14 02:57:09.277434,2025-10-14 02:57:59.931860,0 days 00:00:50.654426,0.9081949563066462,4,gbdt,0.945905858392321,0.19126741386980006,0.5776533787451109,0.005791324980371135,12,44,0.03558248751023937,40,COMPLETE
276,0.761981858594666,2025-10-14 02:57:59.936359,2025-10-14 02:58:37.363365,0 days 00:00:37.427006,0.8909440442433553,4,gbdt,0.927991049271112,0.2847110114794713,0.06508495202933412,0.0073722066759232706,12,52,0.03471977626829583,32,COMPLETE
277,0.76038922482512,2025-10-14 02:58:37.365864,2025-10-14 02:59:06.357344,0 days 00:00:28.991480,0.8936566031089146,4,gbdt,0.9299460664523866,0.2974808627007411,0.08782091089688587,0.007387988352425423,12,53,0.037119536723458205,16,COMPLETE
278,0.7621299255417677,2025-10-14 02:59:06.361765,2025-10-14 02:59:44.226150,0 days 00:00:37.864385,0.9018787539580888,4,gbdt,0.9198940893638132,0.28844149578938655,0.14848430506398788,0.008007793306018784,12,51,0.03492747806499599,32,COMPLETE
279,0.7610401937196521,2025-10-14 02:59:44.231452,2025-10-14 03:00:13.725445,0 days 00:00:29.493993,0.9051328721485427,4,gbdt,0.9227990274199636,0.27831931850814867,0.1580242768686274,0.007727478872261254,12,51,0.03621113459447507,32,COMPLETE
280,0.7608310664956882,2025-10-14 03:00:13.727834,2025-10-14 03:00:49.319446,0 days 00:00:35.591612,0.9239423846328674,5,gbdt,0.9169538463570888,0.297640520769655,0.4972698833140205,0.008038046191116425,12,49,0.001736230091687085,24,COMPLETE
281,0.7608171532580902,2025-10-14 03:00:49.325635,2025-10-14 03:01:21.490220,0 days 00:00:32.164585,0.9358339899362151,4,gbdt,0.93595009169926,0.25945165087241084,0.2617611742091096,0.007075947885778518,12,42,0.035181799911834635,32,COMPLETE
282,0.7615745534619087,2025-10-14 03:01:21.492979,2025-10-14 03:01:46.113231,0 days 00:00:24.620252,0.5905367066084724,4,gbdt,0.9473066420142933,0.21957744587743191,0.0017793838448565621,0.008152690084452505,12,50,0.03725669255548833,32,COMPLETE
283,0.7612764528307383,2025-10-14 03:01:46.117813,2025-10-14 03:02:13.477024,0 days 00:00:27.359211,0.916359869062784,4,gbdt,0.9075885719892652,0.30319671398523407,0.6657144907037187,0.007619133204211767,12,46,0.035937654298723705,24,COMPLETE
284,0.7609423773097543,2025-10-14 03:02:13.480635,2025-10-14 03:02:48.655489,0 days 00:00:35.174854,0.8840303731701222,3,gbdt,0.9315041938536759,0.27764491861315377,0.22512317579136215,0.006585994083455326,12,44,0.03404537228417121,32,COMPLETE
285,0.7618265509430134,2025-10-14 03:02:48.659866,2025-10-14 03:03:16.386837,0 days 00:00:27.726971,0.899035952338297,4,gbdt,0.9559375462802635,0.25219738747929976,0.09937076298493905,0.007130538366201564,5,75,0.026937782243735914,40,COMPLETE
286,0.7616480512409606,2025-10-14 03:03:16.389294,2025-10-14 03:03:47.631361,0 days 00:00:31.242067,0.8732618068484025,4,gbdt,0.9405479940748221,0.3080745896055603,0.6118012196294677,0.007457067944891056,11,79,0.03887408548933017,40,COMPLETE
287,0.761083353340431,2025-10-14 03:03:47.636026,2025-10-14 03:03:57.980068,0 days 00:00:10.344042,0.9075592693869173,4,gbdt,0.9225942679610964,0.27406614282436387,0.13048455141296617,0.037205902447429356,10,48,0.034915262450340975,40,COMPLETE
288,0.7610809234731272,2025-10-14 03:03:57.982293,2025-10-14 03:04:31.058849,0 days 00:00:33.076556,0.8671271212506475,4,gbdt,0.9483552888590698,0.22845652237377034,0.5371603648699973,0.006254339485490961,12,53,0.031257301494722785,32,COMPLETE
289,0.7550963756365536,2025-10-14 03:04:31.062566,2025-10-14 03:04:46.560560,0 days 00:00:15.497994,0.8873492279406775,4,gbdt,0.9347884830325255,0.20658776803440976,0.44826729016690536,0.008275394731848068,3,50,0.03632808671003478,40,COMPLETE
290,0.761547895561706,2025-10-14 03:04:46.563467,2025-10-14 03:05:22.342991,0 days 00:00:35.779524,0.8970590756235028,4,gbdt,0.9173531886157402,0.2887012629288144,0.048282278677644126,0.00675784139961422,12,52,0.03251093840473951,40,COMPLETE
291,0.7611406966869998,2025-10-14 03:05:22.345858,2025-10-14 03:05:50.009855,0 days 00:00:27.663997,0.8808371968827645,4,gbdt,0.9631584681082441,0.2547245072073806,0.37933564294282135,0.007848928509554329,11,46,0.024504934973632694,32,COMPLETE
292,0.7557404507268489,2025-10-14 03:05:50.014080,2025-10-14 03:07:55.547761,0 days 00:02:05.533681,0.8593167979036854,4,dart,0.9420190770666683,0.23915455475297642,0.32108771969400773,0.007107156774546536,12,48,0.03398591393857244,40,COMPLETE
293,0.7608531843930033,2025-10-14 03:07:55.551853,2025-10-14 03:08:30.820354,0 days 00:00:35.268501,0.9112642598096029,5,gbdt,0.9056099224529045,0.9522159750180252,0.5989861533443769,0.006544266241632488,10,45,0.009918636072421692,32,COMPLETE
294,0.7606187642840482,2025-10-14 03:08:30.822752,2025-10-14 03:09:16.805807,0 days 00:00:45.983055,0.9278946037259717,4,gbdt,0.9532208925336226,0.2676085445362658,0.4813893174462002,0.006828221768559208,11,41,0.03807496375579596,40,COMPLETE
295,0.763102642416201,2025-10-14 03:09:16.811220,2025-10-14 03:09:52.737827,0 days 00:00:35.926607,0.8914428654944726,4,gbdt,0.9268567063432027,0.3137958734824771,0.5229611896081667,0.007403066963318373,12,51,0.03677367572089469,40,COMPLETE
296,0.7604495560852796,2025-10-14 03:09:52.742317,2025-10-14 03:10:21.532082,0 days 00:00:28.789765,0.8991894141274602,4,gbdt,0.8943259428388693,0.3106475568850623,0.533045339302094,0.007533240416116682,12,51,0.037146721428886476,40,COMPLETE
297,0.7616697949929448,2025-10-14 03:10:21.534454,2025-10-14 03:10:52.253186,0 days 00:00:30.718732,0.8903566555267518,4,gbdt,0.9312379260810413,0.32390668551719937,0.47716967310558817,0.00843325066877965,12,53,0.03532470477143433,32,COMPLETE
298,0.762417035193625,2025-10-14 03:10:52.257905,2025-10-14 03:11:30.274730,0 days 00:00:38.016825,0.9143208269055778,3,gbdt,0.9242031727726934,0.30197087430468506,0.4325693848531994,0.007310058336849808,12,50,0.033948898140069995,40,COMPLETE
299,0.7610446943185261,2025-10-14 03:11:30.277147,2025-10-14 03:12:13.419469,0 days 00:00:43.142322,0.9171654478438177,3,gbdt,0.9179670432850212,0.285062402366424,0.21583287814255672,0.007867451831643453,12,48,0.03336515504924283,40,COMPLETE
