number,value,datetime_start,datetime_complete,duration,params_alpha,params_booeval_metricster,params_booster,params_colsample_bytree,params_gamma,params_lambda,params_learning_rate,params_max_depth,params_max_leaves,params_min_child_weight,params_subsample,state
87,0.7617535405159728,2025-10-14 03:42:25.693761,2025-10-14 03:42:36.973593,0 days 00:00:11.279832,0.07362627757803147,mae,gbtree,0.6351021829729273,0.006742975601550197,1.2376984761917114,0.035524494377029106,10,96,87,0.9595217994113876,COMPLETE
88,0.7606565365736127,2025-10-14 03:42:36.975469,2025-10-14 03:42:47.650927,0 days 00:00:10.675458,0.13232983082336847,mae,gbtree,0.6274599238143134,0.0023155388652295154,1.458704631290921,0.04999082226223829,10,96,78,0.9070151386391258,COMPLETE
89,0.7605928236854637,2025-10-14 03:42:47.658975,2025-10-14 03:42:59.892716,0 days 00:00:12.233741,0.023213925444603947,mae,gbtree,0.6393106241090647,0.005740537956530064,1.5341476182080527,0.0431122147475282,10,104,65,0.9156053584678193,COMPLETE
90,0.7573407233094399,2025-10-14 03:42:59.905110,2025-10-14 03:43:13.192289,0 days 00:00:13.287179,0.14561735330137413,mae,gbtree,0.6560008472005452,0.008302294831297574,1.3167324725903544,0.013681734726503266,10,80,74,0.9818713585252723,COMPLETE
91,0.7620406160881482,2025-10-14 03:43:13.202533,2025-10-14 03:43:25.225773,0 days 00:00:12.023240,0.061342064070545065,mae,gbtree,0.6244697445408695,0.004233970665068097,1.5116742043055158,0.03803388868752998,10,88,86,0.9239863785575346,COMPLETE
92,0.7619603035461545,2025-10-14 03:43:25.225773,2025-10-14 03:43:36.675926,0 days 00:00:11.450153,0.049310280814332,mae,gbtree,0.6000784408075166,0.004569504015788393,1.6004325487516229,0.03629295260340697,10,96,67,0.9508237703410818,COMPLETE
93,0.7606322198006954,2025-10-14 03:43:36.675926,2025-10-14 03:43:48.516335,0 days 00:00:11.840409,0.09382403932543454,mae,gbtree,0.6208355625554838,0.0018813255641612202,1.6590877177154324,0.028870603545493426,10,88,83,0.8897619820013704,COMPLETE
94,0.7605169323806,2025-10-14 03:43:48.524391,2025-10-14 03:43:59.542682,0 days 00:00:11.018291,0.16103904944236538,mae,gbtree,0.6722778855572272,0.01057340387969917,1.4670772226029118,0.043644423728926324,10,88,90,0.9713134712265123,COMPLETE
95,0.7609551153545551,2025-10-14 03:43:59.542682,2025-10-14 03:44:12.708091,0 days 00:00:13.165409,0.2617482833905301,mae,gbtree,0.6511281820971011,0.004674616352595578,1.3716704741253463,0.03287817908258047,10,104,80,0.9006584459217924,COMPLETE
96,0.7622028907295663,2025-10-14 03:44:12.708091,2025-10-14 03:44:25.387319,0 days 00:00:12.679228,0.23532157701787648,mae,gbtree,0.613863120172437,0.005980285627322279,1.2551600592749623,0.037246861592477046,10,96,58,0.9199122031977753,COMPLETE
97,0.7609612167234542,2025-10-14 03:44:25.392751,2025-10-14 03:46:28.199943,0 days 00:02:02.807192,0.002726573714645311,mae,dart,0.6166084124073445,0.005978574650015453,1.2616709312085541,0.030826626262125498,10,72,61,0.6429417918610711,COMPLETE
98,0.7619608745995866,2025-10-14 03:46:28.206944,2025-10-14 03:46:41.442543,0 days 00:00:13.235599,0.2460174746048338,mae,gbtree,0.6268309654887076,0.008001853185709833,1.160323685842851,0.036650257357041284,10,96,58,0.8799351830597424,COMPLETE
99,0.7614487544818055,2025-10-14 03:46:41.442543,2025-10-14 03:46:54.747156,0 days 00:00:13.304613,0.21591087152178295,mae,gbtree,0.645654460226907,0.0017107306191154088,1.0683056123590549,0.03411813967663336,10,104,48,0.961307861685288,COMPLETE
100,0.7611478245754806,2025-10-14 03:46:54.751681,2025-10-14 03:47:06.358844,0 days 00:00:11.607163,0.18543359444020263,mae,gbtree,0.6101780328225717,0.0037373588645067406,1.3138076146391562,0.041541885753584265,10,80,93,0.9440853542980134,COMPLETE
101,0.7616934869453403,2025-10-14 03:47:06.367069,2025-10-14 03:47:20.051657,0 days 00:00:13.684588,0.28242886793660227,mae,gbtree,0.6338213590092723,0.003348712336943647,1.475656517717153,0.03914026296945179,10,96,49,0.9194473489445982,COMPLETE
102,0.7617108703491826,2025-10-14 03:47:20.057672,2025-10-14 03:47:31.858919,0 days 00:00:11.801247,0.08400626464005005,mae,gbtree,0.6223999277391673,0.005284059165015308,1.5424713326158623,0.038564867711914676,10,96,72,0.9223082893642213,COMPLETE
103,0.7619796502159173,2025-10-14 03:47:31.874330,2025-10-14 03:47:43.425374,0 days 00:00:11.551044,0.1082433452451578,mae,gbtree,0.6398030234256064,0.01224855350864804,1.3859742836488635,0.04228844302008322,10,88,64,0.9087038990649027,COMPLETE
104,0.7638603446499435,2025-10-14 03:47:43.440328,2025-10-14 03:47:56.558690,0 days 00:00:13.118362,0.12734537736853208,mae,gbtree,0.6636371114832225,0.0024413287883050493,1.628472451981166,0.035962471748043,10,104,53,0.8971619038015882,COMPLETE
105,0.760945088298252,2025-10-14 03:47:56.558690,2025-10-14 03:48:09.942207,0 days 00:00:13.383517,0.19857305328390767,mae,gbtree,0.6631143042773131,0.0024602039051999816,1.49727431628623,0.03667420856647965,10,104,53,0.8652850775270637,COMPLETE
106,0.7612847915688132,2025-10-14 03:48:09.942207,2025-10-14 03:48:23.808854,0 days 00:00:13.866647,0.12440907569999395,mae,gbtree,0.675399734453427,0.00019252721210809808,1.6910721966148465,0.03516965357333827,10,112,52,0.8950243402876845,COMPLETE
107,0.7607041488747451,2025-10-14 03:48:23.808854,2025-10-14 03:48:35.858377,0 days 00:00:12.049523,0.1649269086845438,mae,gbtree,0.656698186004853,0.008641436391073305,1.204656389079732,0.03229313308770985,10,88,60,0.8795069322902185,COMPLETE
108,0.7605253828728038,2025-10-14 03:48:35.859377,2025-10-14 03:48:48.794622,0 days 00:00:12.935245,0.0660262077114242,mae,gbtree,0.706451042178145,0.0068547881984262595,1.4248489716205126,0.045279452688657754,10,104,58,0.9785892805994689,COMPLETE
109,0.7533170536779809,2025-10-14 03:48:48.800621,2025-10-14 03:49:01.775729,0 days 00:00:12.975108,0.25329612824215664,mae,gbtree,0.611053139926595,0.004152500304684038,1.2587665775492933,0.00969475146099334,10,80,83,0.9076069224058855,COMPLETE
110,0.760750827812093,2025-10-14 03:49:01.791937,2025-10-14 03:49:14.828705,0 days 00:00:13.036768,0.15757416963481502,mae,gbtree,0.6475819113982573,0.010376622330023004,1.5734636864649911,0.03052197635538168,10,104,67,0.9394724342209707,COMPLETE
111,0.7624427342279675,2025-10-14 03:49:14.841865,2025-10-14 03:49:27.209003,0 days 00:00:12.367138,0.40170062207047635,mae,gbtree,0.631198434470608,0.0015061430991610376,1.6276558637481184,0.03862510194478822,9,96,58,0.9532522284370885,COMPLETE
112,0.7613653220628411,2025-10-14 03:49:27.209003,2025-10-14 03:49:38.575478,0 days 00:00:11.366475,0.3916826724512385,mae,gbtree,0.6919804213888193,0.0014640679554112413,1.7394393118960811,0.034315585898797046,9,96,86,0.9495817813816494,COMPLETE
113,0.7630477379043314,2025-10-14 03:49:38.575478,2025-10-14 03:49:52.358673,0 days 00:00:13.783195,0.2995488974124773,mae,gbtree,0.6279303672094707,0.0030175365530045782,1.6377860886736113,0.037197819973746236,10,96,57,0.9563166183187379,COMPLETE
114,0.7630548785934367,2025-10-14 03:49:52.358673,2025-10-14 03:50:05.375638,0 days 00:00:13.016965,0.2968698259801771,mae,gbtree,0.6652768190090822,0.005819022549218119,1.6321913782589736,0.04071156559799165,10,96,64,0.9657968953819369,COMPLETE
115,0.7618058747177584,2025-10-14 03:50:05.375638,2025-10-14 03:50:17.708876,0 days 00:00:12.333238,0.30789234398092685,mae,gbtree,0.670699291447379,0.0028997163575271165,1.78574832339241,0.0472024118191362,9,112,57,0.9654163293073218,COMPLETE
116,0.7622298104602689,2025-10-14 03:50:17.708876,2025-10-14 03:50:30.901838,0 days 00:00:13.192962,0.28484441437577,mae,gbtree,0.6818542029622152,1.8196835557641577e-05,1.7093935938751401,0.0405900442670638,10,104,62,0.992893156067489,COMPLETE
117,0.7619019359155095,2025-10-14 03:50:30.909127,2025-10-14 03:50:43.442396,0 days 00:00:12.533269,0.42853283523809393,mae,gbtree,0.6652482051312273,3.915425753478821e-05,1.660507751465192,0.04031114395235044,10,96,63,0.9997814590913869,COMPLETE
118,0.7611280330855477,2025-10-14 03:50:43.458597,2025-10-14 03:50:56.987026,0 days 00:00:13.528429,0.3668042560328949,mae,gbtree,0.6824980546952552,0.0013421036720546809,1.6334464510347315,0.042371152738323405,10,104,61,0.9592081169808963,COMPLETE
119,0.7588708945441642,2025-10-14 03:50:56.995990,2025-10-14 03:51:10.722775,0 days 00:00:13.726785,0.29524335954822967,mae,gbtree,0.6535138594123489,0.005489090453914291,1.5772038474159094,0.01627867229572916,9,104,67,0.9891089896739248,COMPLETE
120,0.7484650053150186,2025-10-14 03:51:10.728239,2025-10-14 03:52:57.853800,0 days 00:01:47.125561,0.23307338924481522,mae,dart,0.6401803645129635,0.0027450219663691967,1.6824644714246766,0.006630679121902623,7,96,60,0.983411095997326,COMPLETE
121,0.7607625320726592,2025-10-14 03:52:57.859169,2025-10-14 03:53:08.955639,0 days 00:00:11.096470,0.3239440387076174,mae,gbtree,0.6174456692657075,0.0016420979115866342,1.7233114878396212,0.03347403705017712,10,104,65,0.9734191283417933,COMPLETE
122,0.7601495209969179,2025-10-14 03:53:08.963350,2025-10-14 03:53:20.525564,0 days 00:00:11.562214,0.28772800419815464,mae,gbtree,0.6943614496883994,0.002569142991508181,1.9450323763660262,0.0402147646655752,10,112,56,0.9531365418122896,COMPLETE
123,0.7624265871262426,2025-10-14 03:53:20.546624,2025-10-14 03:53:32.508375,0 days 00:00:11.961751,0.27265554023404115,mae,gbtree,0.7242936162896432,0.0010368526142625258,1.7923698070271383,0.03729540739827356,10,96,52,0.9405836663241444,COMPLETE
124,0.7613552365198726,2025-10-14 03:53:32.515522,2025-10-14 03:53:44.509115,0 days 00:00:11.993593,0.26710626104028595,mae,gbtree,0.7206731980433115,0.0035141680828505656,1.8163822396025555,0.03735401580391851,10,96,51,0.9374897476841416,COMPLETE
125,0.7610281861130936,2025-10-14 03:53:44.509115,2025-10-14 03:53:55.675548,0 days 00:00:11.166433,0.21261774020756355,mae,gbtree,0.6816127804338069,0.0009736684108831604,1.624495482380081,0.044350228690752155,10,88,58,0.9711513779347518,COMPLETE
126,0.7631476424754229,2025-10-14 03:53:55.692148,2025-10-14 03:54:06.597946,0 days 00:00:10.905798,0.24163504162791793,mae,gbtree,0.6047995721685223,0.004744405716181564,1.7495344460483502,0.039218041205903414,10,88,53,0.9453877177296253,COMPLETE
127,0.7591066834752538,2025-10-14 03:54:06.605943,2025-10-14 03:54:17.525539,0 days 00:00:10.919596,0.2944255541146313,mae,gbtree,0.6044016112007666,6.1045904857609e-05,1.774609899181276,0.0402993647115188,10,88,53,0.988281395313072,COMPLETE
128,0.7606529421749092,2025-10-14 03:54:17.539909,2025-10-14 03:54:27.058310,0 days 00:00:09.518401,0.2638834312711377,mae,gbtree,0.6452913394116662,0.0022138734406757627,1.701893974316248,0.04602063070917584,9,80,49,0.9540370897975623,COMPLETE
129,0.7611668508402534,2025-10-14 03:54:27.074359,2025-10-14 03:54:33.258042,0 days 00:00:06.183683,0.3700699484976648,mae,gbtree,0.6586499331268013,0.004464016138691147,1.8731172325092629,0.042731032833804444,6,88,44,0.9465632654347023,COMPLETE
130,0.7619262706628411,2025-10-14 03:54:33.261612,2025-10-14 03:54:44.196938,0 days 00:00:10.935326,0.40627779203710246,mae,gbtree,0.6324252514895085,0.0011405107748783208,1.8047647062635077,0.03880891618939065,10,88,47,0.9321247316743324,COMPLETE
131,0.7623900648236173,2025-10-14 03:54:44.202960,2025-10-14 03:54:54.327137,0 days 00:00:10.124177,0.23265979245960797,mae,gbtree,0.6100032443676767,0.005853762226918925,1.7391923485362404,0.03537457324155787,10,96,63,0.9641327740271453,COMPLETE
132,0.7601239906245221,2025-10-14 03:54:54.327137,2025-10-14 03:55:05.031716,0 days 00:00:10.704579,0.3073089914961411,mae,gbtree,0.6070606244184532,0.004933900015727433,1.6110891846975033,0.03429409803966986,10,96,69,0.9655710731979618,COMPLETE
133,0.7607078100954844,2025-10-14 03:55:05.036005,2025-10-14 03:55:15.502772,0 days 00:00:10.466767,0.20287420038758572,mae,gbtree,0.620616856535171,0.0074750051162376235,1.7496507144777567,0.03606841127564703,10,96,63,0.978155785010275,COMPLETE
134,0.7603681457581676,2025-10-14 03:55:15.510294,2025-10-14 03:55:26.021930,0 days 00:00:10.511636,0.24503131879149337,mae,gbtree,0.6005133252900634,0.0037545404256681004,1.7238597427264037,0.03174725549651421,10,88,55,0.9415245327192965,COMPLETE
135,0.7590473850416602,2025-10-14 03:55:26.029790,2025-10-14 03:55:39.658842,0 days 00:00:13.629052,0.33323123298629514,mae,gbtree,0.8373547023451298,0.009376442243571963,1.557996947045184,0.038465753847447576,10,104,40,0.9587167001341049,COMPLETE
136,0.7625604407338913,2025-10-14 03:55:39.661282,2025-10-14 03:55:49.277758,0 days 00:00:09.616476,0.2781365475105672,mae,gbtree,0.6279089528263503,0.0028928507889962114,1.6539303499592668,0.03564288296511691,10,80,62,0.9315191826852333,COMPLETE
137,0.762279311350143,2025-10-14 03:55:49.293420,2025-10-14 03:55:59.078182,0 days 00:00:09.784762,0.17796186583738965,mae,gbtree,0.6269623178142794,0.005933917236688315,1.6535249538264685,0.03520849682738438,10,80,53,0.9301123364986116,COMPLETE
138,0.7608229749460504,2025-10-14 03:55:59.091044,2025-10-14 03:57:43.040447,0 days 00:01:43.949403,0.2488832194172824,mae,dart,0.6389320060488298,0.03985360608291996,1.6325586578763875,0.032963323402858784,10,72,60,0.9442104226767637,COMPLETE
139,0.7574824509795248,2025-10-14 03:57:43.042464,2025-10-14 03:57:53.207718,0 days 00:00:10.165254,0.35068418377275673,mae,gbtree,0.9982435281818297,0.00254484930340399,1.5888464997403486,0.036726220089512165,9,88,66,0.5272488512394806,COMPLETE
140,0.7629689271374824,2025-10-14 03:57:53.224752,2025-10-14 03:58:03.957248,0 days 00:00:10.732496,0.32033027061632646,mae,gbtree,0.7480865826100915,0.005003972777527291,1.526005110442126,0.028897103003499455,10,80,70,0.9110869333048855,COMPLETE
141,0.7614736940801153,2025-10-14 03:58:03.959006,2025-10-14 03:58:13.993320,0 days 00:00:10.034314,0.27425234097743134,mae,gbtree,0.6165363287490152,0.005218120546061379,1.507779232107264,0.028401725156321816,10,80,69,0.9101150511271168,COMPLETE
142,0.7614112107705389,2025-10-14 03:58:14.000319,2025-10-14 03:58:23.895867,0 days 00:00:09.895548,0.3113894707291376,mae,gbtree,0.6241534629643019,0.00331704574646416,1.5499248004123338,0.0355518316506226,10,80,72,0.9317038843952897,COMPLETE
143,0.7617732108410107,2025-10-14 03:58:23.907990,2025-10-14 03:58:34.709025,0 days 00:00:10.801035,0.32609470753923375,mae,gbtree,0.7520388907007317,0.034815679890500384,1.7799442136450256,0.03365362785114521,10,72,70,0.9542906168015063,COMPLETE
144,0.7610139539211637,2025-10-14 03:58:34.709025,2025-10-14 03:58:44.507748,0 days 00:00:09.798723,0.3821395768029085,mae,gbtree,0.6105728251526,0.004379164937826044,1.4468950968972667,0.03010019700212949,10,80,73,0.9011927971634028,COMPLETE
145,0.761690986670768,2025-10-14 03:58:44.507748,2025-10-14 03:58:56.258798,0 days 00:00:11.751050,0.23039627536512983,mae,gbtree,0.732449934439534,0.006496778002223618,1.687017633122075,0.03180773635606534,10,88,57,0.9639444887101892,COMPLETE
146,0.7617957887041179,2025-10-14 03:58:56.274566,2025-10-14 03:59:08.058564,0 days 00:00:11.783998,0.2669725403691251,mae,gbtree,0.7198178703112592,0.00189247437548184,1.5259832229528065,0.03748685308519522,10,96,50,0.9415904529576506,COMPLETE
147,0.7622280218822088,2025-10-14 03:59:08.067162,2025-10-14 03:59:17.996848,0 days 00:00:09.929686,0.4325239792148505,mae,gbtree,0.7009398891176571,0.003517922174718989,1.6063515138756352,0.04190831904968705,10,64,62,0.9148128689078906,COMPLETE
148,0.761799374409811,2025-10-14 03:59:18.003008,2025-10-14 03:59:29.075384,0 days 00:00:11.072376,0.5094614166554358,mae,gbtree,0.6336809529367428,0.001261931419656973,1.848160690849301,0.03853101873193601,10,96,64,0.8885680262155424,COMPLETE
149,0.7605791556345115,2025-10-14 03:59:29.092256,2025-10-14 03:59:38.975316,0 days 00:00:09.883060,0.30042588977842843,mae,gbtree,0.6492850538381296,0.004901099990591293,1.6639808025690448,0.03438116097607949,9,80,52,0.9311038710196176,COMPLETE
150,0.7625365150133038,2025-10-14 03:59:38.975316,2025-10-14 03:59:50.325457,0 days 00:00:11.350141,0.35510461494220935,mae,gbtree,0.7615313776246967,0.007732042314279724,1.9057522223281995,0.02707870997191677,10,88,76,0.9735230492558257,COMPLETE
151,0.7601428663807164,2025-10-14 03:59:50.342148,2025-10-14 04:00:01.016970,0 days 00:00:10.674822,0.355569280428434,mae,gbtree,0.7639905498860284,0.007179755012866319,1.895449038933692,0.03595652433131341,10,88,77,0.9796427839501299,COMPLETE
152,0.7613358507959134,2025-10-14 04:00:01.025574,2025-10-14 04:00:12.421769,0 days 00:00:11.396195,0.33649405606329286,mae,gbtree,0.7407035609450426,0.007831124351121052,1.9331305002898764,0.028933961933012273,10,88,71,0.9697021859953049,COMPLETE
153,0.7604572869191987,2025-10-14 04:00:12.425389,2025-10-14 04:00:23.683775,0 days 00:00:11.258386,0.39257066246390804,mae,gbtree,0.7809886062103241,0.002903350937449343,1.3944902820321636,0.02628433297488323,10,88,68,0.9528528024084065,COMPLETE
154,0.7616958144226401,2025-10-14 04:00:23.693854,2025-10-14 04:00:34.125095,0 days 00:00:10.431241,0.19412044917322352,mae,gbtree,0.7558738367499742,0.00911468300574788,1.7497880098181195,0.026769980533668167,10,96,76,0.948479081640209,COMPLETE
155,0.7609324377303218,2025-10-14 04:00:34.128463,2025-10-14 04:00:45.442313,0 days 00:00:11.313850,0.32575275534843334,mae,gbtree,0.7264978722799516,0.005335757625763354,1.82163714328873,0.03949434038872252,10,96,74,0.9613249361066079,COMPLETE
156,0.7609017861930457,2025-10-14 04:00:45.449286,2025-10-14 04:00:55.241269,0 days 00:00:09.791983,0.14248480492661067,mae,gbtree,0.958113976154276,0.01204714973891112,1.4682015456590511,0.031272166944601165,8,88,55,0.9246848166682942,COMPLETE
157,0.7604898734292926,2025-10-14 04:00:55.254496,2025-10-14 04:01:06.345725,0 days 00:00:11.091229,0.28133657460925593,mae,gbtree,0.7662314502389461,0.004042968156036759,1.8925071737862844,0.03287867400221268,10,80,42,0.9383328317147273,COMPLETE
158,0.7607350612277821,2025-10-14 04:01:06.347525,2025-10-14 04:01:16.350045,0 days 00:00:10.002520,0.22165315293912785,mae,gbtree,0.7112520896431813,0.001988868459444036,1.9620751003074317,0.041006407102988876,10,72,59,0.9012012946427708,COMPLETE
159,0.759868345807985,2025-10-14 04:01:16.356055,2025-10-14 04:01:28.875944,0 days 00:00:12.519889,0.3660591349096877,mae,gbtree,0.7485186087881892,0.0011671082621069247,1.5592596056974906,0.023261660570495033,10,96,45,0.9734213639120681,COMPLETE
160,0.759438269534262,2025-10-14 04:01:28.898632,2025-10-14 04:01:38.958189,0 days 00:00:10.059557,0.24788317757493372,mae,gbtree,0.7991723987312446,0.006142817334368359,1.6373092117056998,0.037372655662580044,10,80,65,0.6929122014312545,COMPLETE
161,0.7622094281235081,2025-10-14 04:01:38.973675,2025-10-14 04:01:48.991197,0 days 00:00:10.017522,0.17170209237853354,mae,gbtree,0.6262896959636581,0.006195076485732252,1.3459917013847622,0.035373404650211465,10,80,53,0.926663001858725,COMPLETE
162,0.7636876977680421,2025-10-14 04:01:48.991197,2025-10-14 04:01:59.342979,0 days 00:00:10.351782,0.1879432789006828,mae,gbtree,0.6291128948493605,0.003034379179346914,1.6525620289456577,0.03515287709346691,10,80,57,0.9166442864071103,COMPLETE
163,0.7604144383943813,2025-10-14 04:01:59.348991,2025-10-14 04:02:10.959279,0 days 00:00:11.610288,0.10129976797002027,mae,gbtree,0.8216013813700682,0.0031350276235780584,1.6990998183523278,0.04375533710833919,10,88,56,0.915943296456596,COMPLETE
164,0.7566805759368683,2025-10-14 04:02:10.959279,2025-10-14 04:02:15.457995,0 days 00:00:04.498716,0.19975988723242918,mae,gbtree,0.61462602198807,0.045394594141266155,1.78152599194025,0.03916383038626186,10,16,80,0.9459846016199017,COMPLETE
165,0.7602304580934547,2025-10-14 04:02:15.474332,2025-10-14 04:02:25.458443,0 days 00:00:09.984111,0.2591379943864952,mae,gbtree,0.631613447835913,0.0020315923879913956,1.5923083802487745,0.033158848929299774,10,72,60,0.9060982752268726,COMPLETE
166,0.7621027153127473,2025-10-14 04:02:25.474782,2025-10-14 04:02:35.547579,0 days 00:00:10.072797,0.29903713360525735,mae,gbtree,0.6171729182528229,0.004335729447323088,1.8486517424389988,0.03690416707655244,10,80,50,0.9583970631687465,COMPLETE
167,0.7609580874373846,2025-10-14 04:02:35.557714,2025-10-14 04:04:22.975357,0 days 00:01:47.417643,0.22778259690687136,mae,dart,0.6427527683356474,0.0007462970434753845,1.498394631032438,0.03470654882896207,10,96,57,0.8922816242397694,COMPLETE
168,0.760329348844687,2025-10-14 04:04:22.992913,2025-10-14 04:04:33.675705,0 days 00:00:10.682792,0.4158994448095105,mae,gbtree,0.6065931291939238,0.014682629661793602,1.7270629780186386,0.030843060478914514,10,88,62,0.9355724308153764,COMPLETE
169,0.760128060621738,2025-10-14 04:04:33.675705,2025-10-14 04:04:44.797823,0 days 00:00:11.122118,0.2778760847233711,mae,gbtree,0.6213700836793872,0.0028345331706361877,1.6712735779671744,0.020449164333654752,10,96,54,0.9868570682392493,COMPLETE
170,0.7615091691590061,2025-10-14 04:04:44.805824,2025-10-14 04:04:53.108070,0 days 00:00:08.302246,0.20880823327517986,mae,gbtree,0.6373009568862055,0.003611139559407638,1.630510723256576,0.04058218961785369,8,88,75,0.9187547975148824,COMPLETE
171,0.7626989895904582,2025-10-14 04:04:53.113229,2025-10-14 04:05:03.533481,0 days 00:00:10.420252,0.15163735795464472,mae,gbtree,0.6275185343366508,0.006107877737764266,1.6762521343743542,0.03542307952653369,10,80,52,0.9330695593890999,COMPLETE
172,0.7622553881092463,2025-10-14 04:05:03.535484,2025-10-14 04:05:13.576286,0 days 00:00:10.040802,0.1685928026440989,mae,gbtree,0.6323740978898564,0.005020923951546746,1.753532010173998,0.0380758016314097,10,80,47,0.949607376251798,COMPLETE
173,0.7606420714670584,2025-10-14 04:05:13.582783,2025-10-14 04:05:23.757628,0 days 00:00:10.174845,0.15925167196008538,mae,gbtree,0.6006605179373902,0.007852172340515377,1.573408091178794,0.03656680877453062,10,80,52,0.9692381163699768,COMPLETE
174,0.7546211825801956,2025-10-14 04:05:23.770870,2025-10-14 04:05:33.641940,0 days 00:00:09.871070,0.13413511165591563,mae,gbtree,0.6257518173995269,0.002098889236327241,1.687735765399785,0.011856931259310886,10,72,58,0.9335942144075318,COMPLETE
