number,value,datetime_start,datetime_complete,duration,params_alpha,params_booeval_metricster,params_booster,params_colsample_bytree,params_gamma,params_lambda,params_learning_rate,params_max_depth,params_max_leaves,params_min_child_weight,params_subsample,state
263,0.7598980471780273,2025-10-14 04:25:51.464649,2025-10-14 04:26:01.326279,0 days 00:00:09.861630,0.2526042321707565,mae,gbtree,0.6500644446768266,0.002108489208800702,1.3328530940741734,0.033228602608463116,10,72,63,0.9490299526622861,COMPLETE
264,0.7620248718609779,2025-10-14 04:26:01.341738,2025-10-14 04:26:12.126397,0 days 00:00:10.784659,0.2849634745573062,rmse,gbtree,0.617309821603427,0.005713503961728774,1.8572474809941197,0.037914081630851096,10,104,59,0.9650221900673052,COMPLETE
265,0.7613098654020847,2025-10-14 04:26:12.142705,2025-10-14 04:26:23.809512,0 days 00:00:11.666807,0.195053693526243,mae,gbtree,0.6668521516678368,0.007698893837896434,1.5020486010775658,0.040175839092233545,10,96,41,0.935049699291629,COMPLETE
266,0.7621342881086544,2025-10-14 04:26:23.826293,2025-10-14 04:26:32.642591,0 days 00:00:08.816298,0.15393642820136466,mae,gbtree,0.6314797186214594,0.04147437596013774,1.7130096246011641,0.034529670014889054,9,80,76,0.9116432055544775,COMPLETE
267,0.7609643058439017,2025-10-14 04:26:32.654855,2025-10-14 04:26:44.709307,0 days 00:00:12.054452,0.23882478000713975,mae,gbtree,0.6415947991816149,0.0008886069899304598,1.5958519216687241,0.03660508983482302,10,88,57,0.9786989542679142,COMPLETE
268,0.760853317699935,2025-10-14 04:26:44.728145,2025-10-14 04:26:55.376067,0 days 00:00:10.647922,0.2680639488568878,mae,gbtree,0.6833841159258914,0.0026232182929035205,1.4314488253450561,0.03253747035297834,10,80,62,0.9506342447174968,COMPLETE
269,0.7571513514351389,2025-10-14 04:26:55.392745,2025-10-14 04:27:07.775802,0 days 00:00:12.383057,0.35797001130654227,rmse,gbtree,0.7605713669870132,0.006183253137118483,1.6517908453397059,0.03879582580189127,10,88,54,0.5850723256214263,COMPLETE
270,0.7594155601141188,2025-10-14 04:27:07.792755,2025-10-14 04:27:16.982274,0 days 00:00:09.189519,0.3262431057779675,mae,gbtree,0.6098588257151225,0.004240984202336581,1.9064981709600526,0.043695898004908806,8,96,51,0.6832398601285615,COMPLETE
271,0.7609375603013896,2025-10-14 04:27:16.989660,2025-10-14 04:27:28.183320,0 days 00:00:11.193660,0.28505098043594984,mae,gbtree,0.6244987704461803,0.001690494886008748,1.6922393911607285,0.0359624605799205,10,104,61,0.9245919413322539,COMPLETE
272,0.7599418442740864,2025-10-14 04:27:28.192484,2025-10-14 04:27:39.359192,0 days 00:00:11.166708,0.3009402770461577,mae,gbtree,0.660746135571913,0.04698287678457741,1.5500009431618729,0.04153791149582644,10,88,46,0.7212344475020289,COMPLETE
273,0.7619953585549286,2025-10-14 04:27:39.359192,2025-10-14 04:27:49.572295,0 days 00:00:10.213103,0.21931627267957254,mae,gbtree,0.63653032982478,0.028361208999490267,1.6263509524867226,0.028206404250008584,10,80,56,0.9602193996166616,COMPLETE
274,0.7594974202997736,2025-10-14 04:27:49.579330,2025-10-14 04:28:01.643125,0 days 00:00:12.063795,0.5887677659676007,rmse,gbtree,0.7206084043441844,0.005054020165542331,1.4695053155570301,0.03079224274531637,10,96,64,0.9451171843970196,COMPLETE
275,0.7608989192579195,2025-10-14 04:28:01.643125,2025-10-14 04:28:12.742607,0 days 00:00:11.099482,0.53495946117957,mae,gbtree,0.6195425453622567,0.0027721659244472376,0.9691263463441578,0.037807763445830325,10,88,38,0.9700250746244663,COMPLETE
276,0.7619426706632032,2025-10-14 04:28:12.742607,2025-10-14 04:28:23.258993,0 days 00:00:10.516386,0.17231506835200683,mae,gbtree,0.6464094574087509,0.006753033384035811,1.772335526292231,0.03425247931418329,10,80,44,0.8948628179003726,COMPLETE
277,0.7618477648347461,2025-10-14 04:28:23.275837,2025-10-14 04:28:33.692850,0 days 00:00:10.417013,0.14581902930226398,mae,gbtree,0.6290136046916147,0.03967966787727147,1.7197409598976412,0.03909976826431938,10,96,53,0.9282685503987391,COMPLETE
278,0.761673736982103,2025-10-14 04:28:33.708906,2025-10-14 04:30:18.657750,0 days 00:01:44.948844,0.6403496618507064,rmse,dart,0.6551487772687976,0.004431361319955695,1.595968290341255,0.0367480915382991,10,72,79,0.9999009343910719,COMPLETE
279,0.7614508313364545,2025-10-14 04:30:18.665086,2025-10-14 04:30:29.208987,0 days 00:00:10.543901,0.1978925047773418,mae,gbtree,0.606551363791344,0.033249609861334684,0.15802427686862774,0.04098764538929768,10,104,59,0.7587764174952548,COMPLETE
280,0.7607163786097102,2025-10-14 04:30:29.208987,2025-10-14 04:30:39.559205,0 days 00:00:10.350218,0.25318958417726856,mae,gbtree,0.6144237448924262,0.008660868312474984,1.8049859288930716,0.03492370487555221,10,80,49,0.8820738810522045,COMPLETE
281,0.7602576491267969,2025-10-14 04:30:39.574617,2025-10-14 04:30:50.925727,0 days 00:00:11.351110,0.9800743892080325,mae,gbtree,0.7325354690323724,0.03542029328941174,0.8477219471664348,0.03259587515753561,9,88,66,0.9167578134756641,COMPLETE
282,0.761425362988623,2025-10-14 04:30:50.942371,2025-10-14 04:31:03.259974,0 days 00:00:12.317603,0.34019727843998454,mae,gbtree,0.6747606211029068,0.001044272189293402,1.6482264716633948,0.04614310606290308,10,120,55,0.9358891712469427,COMPLETE
283,0.7596478536504435,2025-10-14 04:31:03.276610,2025-10-14 04:31:13.342740,0 days 00:00:10.066130,0.1311421887683131,rmse,gbtree,0.6342195502242295,0.0054160421281865,1.5305084322489462,0.03797661907061163,10,112,74,0.9543541844943565,COMPLETE
284,0.7615332629983215,2025-10-14 04:31:13.362827,2025-10-14 04:31:24.642604,0 days 00:00:11.279777,0.17643819129481977,mae,gbtree,0.6263817896761569,0.003805961686200896,1.7425342123500545,0.035907402385253584,10,96,52,0.9046775928356943,COMPLETE
285,0.7607649317264572,2025-10-14 04:31:24.642604,2025-10-14 04:31:35.409615,0 days 00:00:10.767011,0.31499742048193746,mae,gbtree,0.6433928456685318,0.00734218506861349,1.9505265159938872,0.03967525880094899,10,88,61,0.9858569170330312,COMPLETE
286,0.7567497100390453,2025-10-14 04:31:35.409615,2025-10-14 04:31:45.775831,0 days 00:00:10.366216,0.225323142566117,mae,gbtree,0.6022478872792777,0.0027099560324434315,1.1328768378685277,0.012630124717100386,9,80,58,0.9465890326228931,COMPLETE
287,0.760255679236165,2025-10-14 04:31:45.790564,2025-10-14 04:31:55.176589,0 days 00:00:09.386025,0.36454338977292006,rmse,gbtree,0.6532302577524316,0.005743514927924561,1.8470460842503507,0.03428571152101224,8,88,47,0.9644487224454976,COMPLETE
288,0.761475323008082,2025-10-14 04:31:55.192649,2025-10-14 04:32:06.442759,0 days 00:00:11.250110,0.27771179672807594,mae,gbtree,0.6167363542050188,0.0019355013424973855,1.6971111792964189,0.036975222601110816,10,96,63,0.9760835556285407,COMPLETE
289,0.7620313817684878,2025-10-14 04:32:06.461849,2025-10-14 04:32:16.992663,0 days 00:00:10.530814,0.24137177682842037,mae,gbtree,0.7463641667781684,0.004145824009543312,1.6714611946739912,0.043428219701326494,10,80,71,0.9218608786812829,COMPLETE
290,0.7610035625029918,2025-10-14 04:32:17.012929,2025-10-14 04:32:27.676365,0 days 00:00:10.663436,0.3013489013151317,mae,gbtree,0.6378329148066714,0.006444372671019827,1.5866696613603948,0.0313225138534182,10,104,67,0.934523479696708,COMPLETE
291,0.7627729406809891,2025-10-14 04:32:27.698459,2025-10-14 04:32:39.226068,0 days 00:00:11.527609,0.4200583976477849,rmse,gbtree,0.6237771949451315,0.0027728316899741355,0.6967899776638021,0.04043105598642739,10,96,50,0.957074676582482,COMPLETE
292,0.7613659954091903,2025-10-14 04:32:39.226068,2025-10-14 04:32:47.031111,0 days 00:00:07.805043,0.41420789285002724,rmse,gbtree,0.6262136001637757,0.0004906791332860148,1.4560014373932164,0.04082417334658303,10,48,49,0.9528145079723638,COMPLETE
293,0.7573414081216658,2025-10-14 04:32:47.041370,2025-10-14 04:32:55.725753,0 days 00:00:08.684383,0.43410847648495116,rmse,gbtree,0.6690545237820889,0.00297776815182553,1.3966463729868508,0.04321794072885641,10,88,50,0.9096424163742408,COMPLETE
294,0.7604239823271086,2025-10-14 04:32:55.725753,2025-10-14 04:33:03.925699,0 days 00:00:08.199946,0.38540354388363063,rmse,gbtree,0.6874246850208374,0.0015276980621309875,1.6319246115773567,0.03938694222431628,7,88,53,0.9388468049027217,COMPLETE
295,0.7589061615959213,2025-10-14 04:33:03.925699,2025-10-14 04:33:13.025965,0 days 00:00:09.100266,0.40039282314441194,rmse,gbtree,0.6325210102193185,0.026562998142734603,1.5012312540012693,0.040962150509981136,10,72,51,0.9251135359339411,COMPLETE
296,0.7600231449200737,2025-10-14 04:33:13.047361,2025-10-14 04:34:50.463018,0 days 00:01:37.415657,0.34591433699439234,rmse,dart,0.6440653805964832,0.003183454160604417,0.43270572956425446,0.03858304614839271,6,96,45,0.9449121384709698,COMPLETE
297,0.7557597060754432,2025-10-14 04:34:50.464548,2025-10-14 04:34:55.442549,0 days 00:00:04.978001,0.4503633754423479,rmse,gbtree,0.6219868741196499,0.002292296871210129,1.5262641275400521,0.027083663697253877,5,104,47,0.9572318696832974,COMPLETE
298,0.7619986532812137,2025-10-14 04:34:55.457819,2025-10-14 04:35:05.223617,0 days 00:00:09.765798,0.15604833412918565,rmse,gbtree,0.7015847455831823,0.0042849978988866895,1.0358050848737026,0.04519446595613783,10,80,54,0.9134876663721249,COMPLETE
299,0.7615009027395874,2025-10-14 04:35:05.231265,2025-10-14 04:35:16.642418,0 days 00:00:11.411153,0.378505465088032,rmse,gbtree,0.6494463343645109,0.00113732547570053,0.6264322198559682,0.037331240950264126,10,96,42,0.8993319007332586,COMPLETE
