number,value,datetime_start,datetime_complete,duration,params_alpha,params_booeval_metricster,params_booster,params_colsample_bytree,params_gamma,params_lambda,params_learning_rate,params_max_depth,params_max_leaves,params_min_child_weight,params_subsample,state
175,0.7559987487255115,2025-10-14 04:05:33.658503,2025-10-14 04:05:38.624696,0 days 00:00:04.966193,0.18573085705138342,mae,gbtree,0.6102469989750121,0.005056978407123036,1.437306933882871,0.02513744388220119,5,88,56,0.9235048478293716,COMPLETE
176,0.7625731213764813,2025-10-14 04:05:38.629216,2025-10-14 04:05:51.025516,0 days 00:00:12.396300,0.31523258059582976,rmse,gbtree,0.6427200542488227,0.004185532662799963,1.8056396448195233,0.03442822359566285,10,104,54,0.9125264873091503,COMPLETE
177,0.7474510705824748,2025-10-14 04:05:51.025516,2025-10-14 04:06:03.542355,0 days 00:00:12.516839,0.3570599971326123,rmse,gbtree,0.6486832935100918,0.004002477485497497,1.5251934217011118,0.005382452036261004,10,104,38,0.9052790028972456,COMPLETE
178,0.7599075078217952,2025-10-14 04:06:03.542355,2025-10-14 04:06:13.832167,0 days 00:00:10.289812,0.31906728654331123,rmse,gbtree,0.6594816977730418,0.0008741621151451835,1.9830233902121095,0.03233258843585415,9,112,54,0.9147004016328861,COMPLETE
179,0.7602624901311517,2025-10-14 04:06:13.841323,2025-10-14 04:06:25.359664,0 days 00:00:11.518341,0.4572406209130119,rmse,gbtree,0.6420238890286072,0.0024798085612784413,1.7905733542133635,0.02971159404544239,10,104,49,0.875489576871119,COMPLETE
180,0.7615033550866939,2025-10-14 04:06:25.365438,2025-10-14 04:06:35.859478,0 days 00:00:10.494040,0.3344972633650086,rmse,gbtree,0.6519841707477395,0.003213785032931072,1.6153039998856888,0.033899558493972255,10,80,48,0.8973634071292825,COMPLETE
181,0.7593889420811639,2025-10-14 04:06:35.859478,2025-10-14 04:06:46.391202,0 days 00:00:10.531724,0.11786278105414949,rmse,gbtree,0.6216132929737408,0.03769366383077259,1.7186116980594777,0.03543769841352656,10,96,51,0.9587050263043775,COMPLETE
182,0.7601673684464901,2025-10-14 04:06:46.395909,2025-10-14 04:06:57.576362,0 days 00:00:11.180453,0.2995976956386359,mae,gbtree,0.6290416767036773,0.005893537226641318,1.8233068428092776,0.03883349912411165,10,96,59,0.9426603655180102,COMPLETE
183,0.7594838183569543,2025-10-14 04:06:57.593100,2025-10-14 04:07:08.592914,0 days 00:00:10.999814,0.24455500641118869,mae,gbtree,0.6165627557559209,0.006561668413326786,1.6481476322816062,0.03664277456688096,10,104,55,0.9274493982146212,COMPLETE
184,0.7608818435527636,2025-10-14 04:07:08.609001,2025-10-14 04:07:18.074913,0 days 00:00:09.465912,0.2817712938835884,rmse,gbtree,0.6383156272361293,0.004577629855750685,1.7515618527592807,0.041905482633994774,10,88,63,0.9103511018188394,COMPLETE
185,0.7604009972134824,2025-10-14 04:07:18.074913,2025-10-14 04:07:29.142722,0 days 00:00:11.067809,0.26454934833055915,mae,gbtree,0.6101912728058972,0.007323355076577055,1.8716840871265685,0.0340988786939992,10,104,66,0.978311582888343,COMPLETE
186,0.7600092948501023,2025-10-14 04:07:29.142722,2025-10-14 04:07:39.358213,0 days 00:00:10.215491,0.21657481892157798,mae,gbtree,0.6292847225989142,0.0016964634229689867,1.6892312078560563,0.03940888217378839,10,88,52,0.9382606170157655,COMPLETE
187,0.7612450638565479,2025-10-14 04:07:39.377885,2025-10-14 04:07:46.958766,0 days 00:00:07.580881,0.1439448792955269,mae,gbtree,0.6203927620032097,0.0037704381391605677,1.5805587762318722,0.03187737249831183,7,96,57,0.952446162137273,COMPLETE
188,0.7616809062816462,2025-10-14 04:07:46.958766,2025-10-14 04:07:58.609710,0 days 00:00:11.650944,0.31446814230008635,mae,gbtree,0.6414390913696165,0.0055424040583800785,1.9213980052432253,0.027921996157769385,10,88,61,0.9643871462025161,COMPLETE
189,0.7573345557525986,2025-10-14 04:07:58.609710,2025-10-14 04:08:08.098220,0 days 00:00:09.488510,0.34508451509444943,rmse,gbtree,0.7287369366793507,0.0005253549303371305,0.7826190133544626,0.03754584695740449,10,80,59,0.9195640122436359,COMPLETE
190,0.761141811656015,2025-10-14 04:08:08.108724,2025-10-14 04:08:20.926319,0 days 00:00:12.817595,0.3791524250497519,mae,gbtree,0.746499303180671,0.0488352398516241,1.8013270941008732,0.0359661030667003,10,96,55,0.9332877735162506,COMPLETE
191,0.7621664144054263,2025-10-14 04:08:20.943150,2025-10-14 04:08:31.825224,0 days 00:00:10.882074,0.17175366042832713,mae,gbtree,0.6274243593172235,0.006225730277154909,1.6546949349552935,0.034962157939844724,10,80,52,0.9267345397426456,COMPLETE
192,0.7618786992140706,2025-10-14 04:08:31.825224,2025-10-14 04:08:42.129197,0 days 00:00:10.303973,0.18126878321750717,mae,gbtree,0.6346684522491438,0.00535967570426815,1.6391213527055082,0.03485776046638669,10,72,53,0.9447373773496599,COMPLETE
193,0.7611882339050076,2025-10-14 04:08:42.142490,2025-10-14 04:08:53.026132,0 days 00:00:10.883642,0.2458680079490273,mae,gbtree,0.6128877778890245,0.0044387353832423294,1.7284828311388838,0.03273815008597459,10,80,54,0.9311537240059029,COMPLETE
194,0.7606318061218066,2025-10-14 04:08:53.045168,2025-10-14 04:09:04.234532,0 days 00:00:11.189364,0.19761619783354656,mae,gbtree,0.622017376387586,0.008526535834808783,1.5454160861057025,0.04025283767071632,10,80,57,0.8879728961221873,COMPLETE
195,0.7614293075280619,2025-10-14 04:09:04.242344,2025-10-14 04:09:14.548632,0 days 00:00:10.306288,0.15060990682320186,mae,gbtree,0.6277574901240879,0.002723614542705568,1.6716733531308738,0.038059609217693934,10,80,51,0.9097550982979333,COMPLETE
196,0.7622381268969908,2025-10-14 04:09:14.548632,2025-10-14 04:09:24.909128,0 days 00:00:10.360496,0.30077998389925753,mae,gbtree,0.6458467679592289,0.006969579441528956,1.4767330324948826,0.036166171015277394,10,88,71,0.9671256684479385,COMPLETE
197,0.7613047441160223,2025-10-14 04:09:24.928464,2025-10-14 04:11:14.075911,0 days 00:01:49.147447,0.22802556767442955,mae,dart,0.6330513728861699,0.0018090762311358526,1.606679361586024,0.033528280223281054,10,104,65,0.9568647879928636,COMPLETE
198,0.7623373678816304,2025-10-14 04:11:14.092768,2025-10-14 04:11:24.926219,0 days 00:00:10.833451,0.09556032824148308,mae,gbtree,0.816310078635935,0.003623218462099601,1.7602831870708662,0.04223982549730023,10,88,68,0.9423829015425659,COMPLETE
199,0.7589738495310804,2025-10-14 04:11:24.926219,2025-10-14 04:11:35.742431,0 days 00:00:10.816212,0.08379159288384969,mae,gbtree,0.8122699440639748,0.0034064449549028753,1.8314562515964246,0.04253821182955537,10,88,67,0.9459863309309618,COMPLETE
200,0.7612522350554101,2025-10-14 04:11:35.762756,2025-10-14 04:11:46.008458,0 days 00:00:10.245702,0.10852796961591288,rmse,gbtree,0.8331118071763385,0.0024758643782000775,1.771820198973677,0.040528119575004844,10,96,69,0.9766499371514646,COMPLETE
201,0.7596990824609127,2025-10-14 04:11:46.014104,2025-10-14 04:11:55.993248,0 days 00:00:09.979144,0.12317636760042708,mae,gbtree,0.6704374135475581,0.00455909934032317,1.7056374028042636,0.04460158116766024,10,88,73,0.9363165212229964,COMPLETE
202,0.7586676257798691,2025-10-14 04:11:56.002163,2025-10-14 04:12:07.497979,0 days 00:00:11.495816,0.2694465055506792,mae,gbtree,0.8193468878815358,0.0052608767084685775,1.6606995505817501,0.015072735170124302,10,80,54,0.9201683352315356,COMPLETE
203,0.7612535525050222,2025-10-14 04:12:07.504029,2025-10-14 04:12:18.342475,0 days 00:00:10.838446,0.09717103049836776,mae,gbtree,0.8231870795504629,0.001338623955132044,1.7340978320557585,0.038492615351259606,10,88,64,0.9525107713977369,COMPLETE
204,0.7612343122937559,2025-10-14 04:12:18.351329,2025-10-14 04:12:29.957856,0 days 00:00:11.606527,0.33209973615493227,mae,gbtree,0.7872471464325388,5.344920520256968e-05,1.4003682539224533,0.035515734165078805,10,96,56,0.9421359394917505,COMPLETE
205,0.762286698633402,2025-10-14 04:12:29.959524,2025-10-14 04:12:41.216238,0 days 00:00:11.256714,0.2937736971075039,mae,gbtree,0.8072362003669685,0.003639222395366074,1.6182185612088646,0.03762955943232191,10,80,62,0.9270308027871045,COMPLETE
206,0.7607027327670685,2025-10-14 04:12:41.222310,2025-10-14 04:12:52.333497,0 days 00:00:11.111187,0.0399404595879151,mae,gbtree,0.8088200601510604,0.0035207789071563522,0.9304496775088819,0.042118176058230844,10,96,61,0.902883142837171,COMPLETE
207,0.7610396926917883,2025-10-14 04:12:52.345388,2025-10-14 04:13:04.275717,0 days 00:00:11.930329,0.2902745378927758,mae,gbtree,0.8002164713804507,0.0024507690971013445,1.5783854075619264,0.03750462231940121,10,88,63,0.9125884464956212,COMPLETE
208,0.7603086235210438,2025-10-14 04:13:04.292577,2025-10-14 04:13:16.073817,0 days 00:00:11.781240,0.3177671868668339,mae,gbtree,0.8069540836056931,0.004327709412459952,1.6147413867520084,0.03911526614867039,10,104,68,0.962309396330982,COMPLETE
209,0.7593832263783378,2025-10-14 04:13:16.078716,2025-10-14 04:13:26.592553,0 days 00:00:10.513837,0.3465712538737257,mae,gbtree,0.8187980832135405,0.0014888785348095785,1.5259106081562677,0.04116878293438536,10,72,59,0.9269029726442655,COMPLETE
210,0.7607845194767199,2025-10-14 04:13:26.609709,2025-10-14 04:13:37.442926,0 days 00:00:10.833217,0.5599156176915568,mae,gbtree,0.7932958553207599,0.0033884532619580044,1.7955428654287096,0.036944450952678363,10,80,60,0.9522660891091197,COMPLETE
211,0.760528846652561,2025-10-14 04:13:37.442926,2025-10-14 04:13:47.934911,0 days 00:00:10.491985,0.25361526118786887,mae,gbtree,0.8000984711198332,0.006200127328660437,1.663560807217825,0.03475384105580969,10,80,66,0.9309253461490924,COMPLETE
212,0.7610028546900647,2025-10-14 04:13:47.945424,2025-10-14 04:13:58.436929,0 days 00:00:10.491505,0.2787770273840063,mae,gbtree,0.620184521632073,0.005756916172300088,1.710039722419401,0.03598242043338191,10,80,50,0.9178699990106525,COMPLETE
213,0.7616959226766689,2025-10-14 04:13:58.441966,2025-10-14 04:14:08.833492,0 days 00:00:10.391526,0.21163196297425493,mae,gbtree,0.6093390508414018,0.0028691077506923465,1.63095540659964,0.03891168842066241,10,88,53,0.9387693924963793,COMPLETE
214,0.7586795254242868,2025-10-14 04:14:08.842360,2025-10-14 04:14:19.312186,0 days 00:00:10.469826,0.36718337758776876,mae,gbtree,0.6158797756518354,0.0044462627910039675,1.7647294710741421,0.033350795217960645,10,80,57,0.7431461636349456,COMPLETE
215,0.7614808314530223,2025-10-14 04:14:19.316203,2025-10-14 04:14:29.025745,0 days 00:00:09.709542,0.13491567186927425,mae,gbtree,0.6361052156023332,0.007641757814715694,1.8769149556317841,0.030476724497887315,10,88,62,0.9232758528869742,COMPLETE
216,0.7620298396891703,2025-10-14 04:14:29.032967,2025-10-14 04:14:38.658178,0 days 00:00:09.625211,0.30138969689700096,mae,gbtree,0.6000093229624784,0.003902565983421087,1.5672486527745753,0.03706063944229167,10,80,55,0.9446109460425187,COMPLETE
217,0.7580629709092064,2025-10-14 04:14:38.658178,2025-10-14 04:14:44.108130,0 days 00:00:05.449952,0.18133392806106252,rmse,gbtree,0.6253284449027708,0.043313870208000496,1.6739048676889994,0.031727787910513304,8,24,71,0.9705454240477118,COMPLETE
218,0.7598687169366346,2025-10-14 04:14:44.113831,2025-10-14 04:14:50.831422,0 days 00:00:06.717591,0.24051036092980385,mae,gbtree,0.9114033719488043,0.0011982064830781043,1.488731737139344,0.03450393539504196,6,96,49,0.8992027649053568,COMPLETE
219,0.7611552568164746,2025-10-14 04:14:50.841138,2025-10-14 04:15:01.208007,0 days 00:00:10.366869,0.27147535935401323,mae,gbtree,0.8495426907536692,0.006778061609084123,1.6059377919254598,0.04022823827323991,10,72,75,0.9339459494793433,COMPLETE
220,0.7613432720216146,2025-10-14 04:15:01.214700,2025-10-14 04:15:14.092911,0 days 00:00:12.878211,0.3988876929997017,mae,gbtree,0.7133363588850989,0.0025703940916158253,1.7146866586900535,0.038271186699630026,10,104,36,0.9131330470506738,COMPLETE
221,0.7633221329781643,2025-10-14 04:15:14.102255,2025-10-14 04:15:23.791400,0 days 00:00:09.689145,0.1710411390468897,mae,gbtree,0.631381852835381,0.005168737164653913,1.7545020548687218,0.03752956997477198,10,80,46,0.9531866650747979,COMPLETE
222,0.76264505539182,2025-10-14 04:15:23.806610,2025-10-14 04:15:33.741395,0 days 00:00:09.934785,0.1631388949933139,mae,gbtree,0.6381927730650195,0.0053030521280719575,1.7360155254448255,0.03544147892440547,10,80,45,0.9614698039933547,COMPLETE
223,0.7622795403848448,2025-10-14 04:15:33.745598,2025-10-14 04:15:44.125683,0 days 00:00:10.380085,0.15036705010199822,mae,gbtree,0.6542487113231875,0.004809996370203584,1.7529959586452883,0.03691549707366969,10,80,44,0.9579289145566348,COMPLETE
224,0.7593925499344002,2025-10-14 04:15:44.141131,2025-10-14 04:15:54.959281,0 days 00:00:10.818150,0.3136636137948963,mae,gbtree,0.6416491516415874,0.003953910015405878,1.7900249215515809,0.03987730725342291,10,88,41,0.9881633407120385,COMPLETE
225,0.7592962188730261,2025-10-14 04:15:54.959281,2025-10-14 04:16:05.876035,0 days 00:00:10.916754,0.12572414356322745,mae,gbtree,0.6341147622677875,0.005381205039386706,1.8463767776288984,0.03554917018118783,10,80,46,0.9657029581364066,COMPLETE
226,0.7600731124085485,2025-10-14 04:16:05.896297,2025-10-14 04:16:17.759351,0 days 00:00:11.863054,0.2089384116977238,mae,gbtree,0.7386379023162334,0.002021801418890728,1.4338281055869806,0.03799286216993296,10,96,47,0.9768057145631323,COMPLETE
227,0.7609723865403539,2025-10-14 04:16:17.759351,2025-10-14 04:16:28.076524,0 days 00:00:10.317173,0.16071851940193768,rmse,gbtree,0.6216489981359848,0.003332895445543352,1.7006267169167566,0.04215293361217632,10,88,78,0.953081327014125,COMPLETE
228,0.7601998737273956,2025-10-14 04:16:28.081324,2025-10-14 04:16:38.575523,0 days 00:00:10.494199,0.3379592915712987,mae,gbtree,0.7707609303216238,2.1659618410372217e-05,1.7343375630133313,0.03351694721743536,10,72,43,0.9475954374892144,COMPLETE
229,0.7591825499573175,2025-10-14 04:16:38.575523,2025-10-14 04:18:23.159124,0 days 00:01:44.583601,0.2544967795633788,mae,dart,0.6418216641209316,0.03174403446253733,1.8058232419584035,0.04379675600487704,9,80,45,0.9649978718638389,COMPLETE
230,0.7595928848922296,2025-10-14 04:18:23.159124,2025-10-14 04:18:32.808775,0 days 00:00:09.649651,0.2845975871401556,mae,gbtree,0.6649483591726211,0.00547214257417479,1.9437368384330298,0.03634356410810431,10,64,40,0.9413847827064526,COMPLETE
231,0.7626010592801268,2025-10-14 04:18:32.808775,2025-10-14 04:18:43.492524,0 days 00:00:10.683749,0.15093612228018072,mae,gbtree,0.6536982946397433,0.004917996329183868,1.754197611964733,0.037418796510640485,10,80,44,0.9575162601800385,COMPLETE
232,0.7581203827322592,2025-10-14 04:18:43.492524,2025-10-14 04:18:54.242681,0 days 00:00:10.750157,0.139133876252188,mae,gbtree,0.6478506190153732,0.006504512932744115,1.7620523176993412,0.017460501641269135,10,80,43,0.9591033965917815,COMPLETE
233,0.7610356542537324,2025-10-14 04:18:54.259348,2025-10-14 04:19:06.059228,0 days 00:00:11.799880,0.11019833591231111,mae,gbtree,0.8132678215190997,0.004529585530749869,1.6826273375844865,0.03896825040198898,10,80,39,0.9721578629730667,COMPLETE
234,0.750619817926634,2025-10-14 04:19:06.075994,2025-10-14 04:19:17.003266,0 days 00:00:10.927272,0.18340852377627054,mae,gbtree,0.659520031002935,0.003056435488258358,1.7398388258119832,0.007939367530375973,10,88,48,0.9522002789100775,COMPLETE
235,0.7609555345252458,2025-10-14 04:19:17.009467,2025-10-14 04:19:27.258415,0 days 00:00:10.248948,0.07527860658173012,mae,gbtree,0.6321811776390494,0.0053268515708136555,1.8281285107025156,0.037554828678624114,10,80,43,0.9816370320893727,COMPLETE
236,0.7615707849032423,2025-10-14 04:19:27.258415,2025-10-14 04:19:38.559463,0 days 00:00:11.301048,0.2319317735550628,mae,gbtree,0.828720998456154,0.0018079991666206075,1.3642584537359352,0.03505930289570075,10,80,45,0.9401725132425179,COMPLETE
237,0.761688089783867,2025-10-14 04:19:38.579345,2025-10-14 04:19:49.809387,0 days 00:00:11.230042,0.1581768707762799,mae,gbtree,0.6458477489968825,0.0035673280974872915,1.901672807619583,0.040189441962805425,10,96,51,0.9617181731008493,COMPLETE
238,0.7629321868897516,2025-10-14 04:19:49.809387,2025-10-14 04:19:58.610911,0 days 00:00:08.801524,0.1917648322388504,rmse,gbtree,0.6751260148844661,0.00757103846463613,1.626559373679844,0.03653131403153021,8,88,66,0.9250591140994523,COMPLETE
239,0.7606521260454143,2025-10-14 04:19:58.628288,2025-10-14 04:20:07.341289,0 days 00:00:08.713001,0.19415224279158314,rmse,gbtree,0.6904841357558371,0.008471385746241825,1.0579793672641349,0.03333883085976584,8,88,67,0.9490258271726842,COMPLETE
240,0.762076601708605,2025-10-14 04:20:07.347266,2025-10-14 04:20:15.946588,0 days 00:00:08.599322,0.16965712753626974,rmse,gbtree,0.6556542029709214,0.010029383383092928,1.7017243293384072,0.0356465673614663,8,88,68,0.9716351066935761,COMPLETE
241,0.7625657470866835,2025-10-14 04:20:15.946588,2025-10-14 04:20:26.781652,0 days 00:00:10.835064,0.22066432717648507,rmse,gbtree,0.675829206374805,0.007352677233808805,1.626556861354109,0.03775413841739807,10,88,66,0.9240281118412731,COMPLETE
242,0.7615889067838322,2025-10-14 04:20:26.783658,2025-10-14 04:20:37.492349,0 days 00:00:10.708691,0.1822424653068456,rmse,gbtree,0.6729666911995114,0.007056181952277113,1.631813101433172,0.03878659004164513,10,88,64,0.9102104477958161,COMPLETE
243,0.7602141829389777,2025-10-14 04:20:37.492349,2025-10-14 04:20:44.715305,0 days 00:00:07.222956,0.20949939299780665,rmse,gbtree,0.6793993437817794,0.008030398916839368,1.6602629339784318,0.03670826799314538,7,88,65,0.9250581216186387,COMPLETE
244,0.7606335618156426,2025-10-14 04:20:44.721320,2025-10-14 04:20:55.100390,0 days 00:00:10.379070,0.22888998139077496,rmse,gbtree,0.6632002635300591,0.006528862043824764,1.5449397585739109,0.034413538503344124,10,96,66,0.6251862032349379,COMPLETE
245,0.7618835466819914,2025-10-14 04:20:55.108592,2025-10-14 04:21:05.609021,0 days 00:00:10.500429,0.14608063986275038,rmse,gbtree,0.6723423680129739,0.007371355841655783,1.7705306711265587,0.04110888885746492,10,88,69,0.9380851861294106,COMPLETE
246,0.7591967926096572,2025-10-14 04:21:05.609021,2025-10-14 04:21:14.341785,0 days 00:00:08.732764,0.21031717630798064,rmse,gbtree,0.6974027673909285,0.009173371665929216,1.5971762105349976,0.03640263513883154,10,88,42,0.9184093786626448,COMPLETE
247,0.7538257877487006,2025-10-14 04:21:14.341785,2025-10-14 04:21:18.307853,0 days 00:00:03.966068,0.18893361212739035,rmse,gbtree,0.6535778010204862,0.005620457192878089,1.6883514405796858,0.0322806839036477,4,96,70,0.9339987987170472,COMPLETE
248,0.7607202262539525,2025-10-14 04:21:18.316222,2025-10-14 04:21:27.891071,0 days 00:00:09.574849,0.12590532706326674,rmse,gbtree,0.6660242238322372,0.006433240694062503,1.7301798996197508,0.039333959025066714,9,104,53,0.9552187881339775,COMPLETE
249,0.7614637407954699,2025-10-14 04:21:27.899557,2025-10-14 04:21:39.109445,0 days 00:00:11.209888,0.09948927518267339,rmse,gbtree,0.6885929200583124,0.011326474011809525,1.6488612757505756,0.03802020231715506,10,96,65,0.9009819338296359,COMPLETE
250,0.7603297354667988,2025-10-14 04:21:39.125067,2025-10-14 04:21:46.742258,0 days 00:00:07.617191,0.22861870507531584,rmse,gbtree,0.6280773589326742,0.0049041030702715975,1.9923639920283343,0.03444091450266699,7,88,73,0.9226082433403741,COMPLETE
251,0.7616274944758133,2025-10-14 04:21:46.754209,2025-10-14 04:21:58.756191,0 days 00:00:12.001982,0.16516236578324506,mae,gbtree,0.6780912535270834,0.000873652778018562,1.8073192474898947,0.03602536126830336,10,88,55,0.9433531350428507,COMPLETE
252,0.7629136923380612,2025-10-14 04:21:58.758938,2025-10-14 04:22:10.892721,0 days 00:00:12.133783,0.26077530427341367,mae,gbtree,0.6142385186018898,0.008319727323717893,1.467141073408856,0.04111314978432722,10,96,58,0.9626123709355376,COMPLETE
253,0.761589297369963,2025-10-14 04:22:10.899187,2025-10-14 04:22:22.766213,0 days 00:00:11.867026,0.2587002924023743,mae,gbtree,0.6150851938530039,0.008259897908119377,1.4676228091260968,0.039980982070486906,10,96,58,0.9670587610518838,COMPLETE
254,0.7594080598756747,2025-10-14 04:22:22.773764,2025-10-14 04:22:31.507966,0 days 00:00:08.734202,0.2428295944301951,rmse,gbtree,0.6072987031182376,0.007558505701820892,1.4124389307080325,0.037524138044004285,8,104,56,0.9598627241030634,COMPLETE
255,0.7612094046691725,2025-10-14 04:22:31.515979,2025-10-14 04:22:43.759625,0 days 00:00:12.243646,0.26729634855694245,mae,gbtree,0.6214102300071964,0.009715830649568415,1.5013252867396218,0.03358488758890803,10,96,46,0.9811558942096783,COMPLETE
256,0.7609456163398691,2025-10-14 04:22:43.759625,2025-10-14 04:22:55.257922,0 days 00:00:11.498297,0.3251010224202355,mae,gbtree,0.6389635159433008,0.006185102723678853,1.5232310183822508,0.03132841794926451,9,96,58,0.9900632622399109,COMPLETE
257,0.7612845525220346,2025-10-14 04:22:55.259464,2025-10-14 04:23:07.610261,0 days 00:00:12.350797,0.20329732402270514,mae,gbtree,0.6147111545631971,0.008823779238384793,1.5671203381276246,0.03567906322638163,10,112,50,0.9067657328750304,COMPLETE
258,0.7595092422188391,2025-10-14 04:23:07.625982,2025-10-14 04:25:06.620562,0 days 00:01:58.994580,0.3513534908804535,mae,dart,0.6293747550373885,0.020519193859952396,1.4508424674472153,0.02958997168662205,10,104,60,0.8927310024823277,COMPLETE
259,0.7612445144427757,2025-10-14 04:25:06.625890,2025-10-14 04:25:18.825180,0 days 00:00:12.199290,0.2229281991026505,rmse,gbtree,0.7062600361503868,0.007137526779679759,1.6195139658174116,0.039273240604712004,10,96,52,0.9304811026295945,COMPLETE
260,0.7607051255690485,2025-10-14 04:25:18.825913,2025-10-14 04:25:29.274806,0 days 00:00:10.448893,0.3801373899191077,mae,gbtree,0.6068821469184287,0.017298914136157806,1.391227505094024,0.037351468317416106,10,80,54,0.9726012694033802,COMPLETE
261,0.7622926787769092,2025-10-14 04:25:29.282935,2025-10-14 04:25:40.632463,0 days 00:00:11.349528,0.30927860762486153,mae,gbtree,0.6364852083938815,0.004741405853505552,1.5666004021461495,0.0352576169988218,10,96,56,0.9575331964074479,COMPLETE
262,0.7619164461555463,2025-10-14 04:25:40.633286,2025-10-14 04:25:51.464649,0 days 00:00:10.831363,0.48176197706401636,mae,gbtree,0.6241666935615099,0.013509082234384785,1.6686630484098222,0.04172947174861999,10,80,48,0.9169505172328026,COMPLETE
